movieId,title,avg_rating,review,clean_review,compound,pos,neg,neu,sentiment_label
7153,"Lord of the Rings: The Return of the King, The (2003)",4.118918918918919,Beautiful but the hobbit farewell scenes go on forever. Minor complaint for a masterwork.,beautiful but the hobbit farewell scenes go on forever. minor complaint for a masterwork.,-0.09,0.142,0.162,0.696,negative
7153,"Lord of the Rings: The Return of the King, The (2003)",4.118918918918919,A perfect ending to the greatest film trilogy ever made.,a perfect ending to the greatest film trilogy ever made.,0.836,0.497,0.0,0.503,positive
7153,"Lord of the Rings: The Return of the King, The (2003)",4.118918918918919,The Grey Havens farewell is one of cinema's most beautiful and heartbreaking moments.,the grey havens farewell is one of cinema's most beautiful and heartbreaking moments.,0.2799,0.289,0.175,0.536,positive
588,Aladdin (1992),3.792349726775957,Robin Williams as the Genie is one of the greatest voice performances ever recorded.,robin williams as the genie is one of the greatest voice performances ever recorded.,0.6369,0.244,0.0,0.756,positive
588,Aladdin (1992),3.792349726775957,A classic Disney film. The songs are incredible and the story is charming.,a classic disney film. the songs are incredible and the story is charming.,0.5859,0.241,0.0,0.759,positive
588,Aladdin (1992),3.792349726775957,"Bright, fun, and constantly inventive. Williams improvised most of his best moments.","bright, fun, and constantly inventive. williams improvised most of his best moments.",0.8925,0.542,0.0,0.458,positive
588,Aladdin (1992),3.792349726775957,The animation is gorgeous. A high point for Disney's second golden age.,the animation is gorgeous. a high point for disney's second golden age.,0.6124,0.267,0.0,0.733,positive
588,Aladdin (1992),3.792349726775957,Enjoyable but fairly thin on story. Williams carries everything on his back.,enjoyable but fairly thin on story. williams carries everything on his back.,0.2382,0.151,0.0,0.849,positive
588,Aladdin (1992),3.792349726775957,A whole new world is one of the greatest Disney songs. The film lives up to it.,a whole new world is one of the greatest disney songs. the film lives up to it.,0.6369,0.208,0.0,0.792,positive
588,Aladdin (1992),3.792349726775957,Fun and fast-moving. The villain Jafar is wonderfully theatrical.,fun and fastmoving. the villain jafar is wonderfully theatrical.,0.5574,0.429,0.214,0.357,positive
588,Aladdin (1992),3.792349726775957,Nostalgic perfection. This film defined my childhood.,nostalgic perfection. this film defined my childhood.,0.5719,0.381,0.0,0.619,positive
608,Fargo (1996),4.116022099447513,The Coens at their most perfectly balanced between dark comedy and genuine horror.,the coens at their most perfectly balanced between dark comedy and genuine horror.,0.5095,0.338,0.179,0.483,positive
608,Fargo (1996),4.116022099447513,Frances McDormand's Marge Gunderson is one of cinema's greatest characters.,frances mcdormand's marge gunderson is one of cinema's greatest characters.,0.6369,0.318,0.0,0.682,positive
608,Fargo (1996),4.116022099447513,A masterpiece of tone. Somehow funny and genuinely disturbing at the same time.,a masterpiece of tone. somehow funny and genuinely disturbing at the same time.,0.5719,0.345,0.163,0.493,positive
608,Fargo (1996),4.116022099447513,The Minnesota accents are almost a character in themselves. Brilliantly observed.,the minnesota accents are almost a character in themselves. brilliantly observed.,0.6124,0.286,0.0,0.714,positive
608,Fargo (1996),4.116022099447513,The wood chipper scene is one of cinema's most shocking moments. Nothing prepares you for it.,the wood chipper scene is one of cinema's most shocking moments. nothing prepares you for it.,-0.4576,0.0,0.166,0.834,negative
608,Fargo (1996),4.116022099447513,Deliberately paced and incredibly assured. The Coens know exactly what they're doing.,deliberately paced and incredibly assured. the coens know exactly what they're doing.,0.4201,0.202,0.0,0.798,positive
608,Fargo (1996),4.116022099447513,Quirky but not in an annoying way. A film that earns every laugh.,quirky but not in an annoying way. a film that earns every laugh.,0.8311,0.414,0.0,0.586,positive
608,Fargo (1996),4.116022099447513,McDormand deserved every award she received. A towering performance.,mcdormand deserved every award she received. a towering performance.,0.5423,0.304,0.0,0.696,positive
2762,"Sixth Sense, The (1999)",3.893854748603352,The twist is extraordinary. On re-watch you realize every clue was there all along.,the twist is extraordinary. on rewatch you realize every clue was there all along.,0.0,0.0,0.0,1.0,neutral
2762,"Sixth Sense, The (1999)",3.893854748603352,Haley Joel Osment gives one of the greatest child performances ever recorded.,haley joel osment gives one of the greatest child performances ever recorded.,0.6369,0.276,0.0,0.724,positive
2762,"Sixth Sense, The (1999)",3.893854748603352,Bruce Willis is unusually understated and it works perfectly.,bruce willis is unusually understated and it works perfectly.,0.6369,0.344,0.0,0.656,positive
2762,"Sixth Sense, The (1999)",3.893854748603352,"The twist only works once. After that, the movie is fairly thin.","the twist only works once. after that, the movie is fairly thin.",0.0,0.0,0.0,1.0,neutral
2762,"Sixth Sense, The (1999)",3.893854748603352,Slow-burn psychological horror done masterfully. M. Night was genuinely special here.,slowburn psychological horror done masterfully. m. night was genuinely special here.,-0.25,0.175,0.24,0.584,negative
2762,"Sixth Sense, The (1999)",3.893854748603352,The relationship between the child and Willis is beautifully developed.,the relationship between the child and willis is beautifully developed.,0.5719,0.291,0.0,0.709,positive
2762,"Sixth Sense, The (1999)",3.893854748603352,A genuinely moving film beneath the horror elements. The ending is devastating.,a genuinely moving film beneath the horror elements. the ending is devastating.,-0.8402,0.0,0.444,0.556,negative
2762,"Sixth Sense, The (1999)",3.893854748603352,The craft here is extraordinary. The color red motif rewards multiple viewings.,the craft here is extraordinary. the color red motif rewards multiple viewings.,0.4767,0.22,0.0,0.78,positive
